{
  "kind": "worm_adapter_emission",
  "schemaVersion": 1,
  "adapterName": "gitmodules_parse",
  "sourceRepo": "Boswecw/Cortex",
  "sourceArtifact": {
    "path": ".gitmodules",
    "artifactSha256": "abc123"
  },
  "emittedEdges": [
    {
      "kind": "worm_edge",
      "schemaVersion": 1,
      "edgeId": "edge-101",
      "relationType": "git_submodule",
      "sourceRepo": "Boswecw/Cortex",
      "sourceArtifact": {
        "path": ".gitmodules",
        "line": 3,
        "artifactSha256": "abc123"
      },
      "discoveryMethod": "gitmodules_parse",
      "target": {
        "rawReference": "../linked-repo",
        "normalizedRepo": "Boswecw/linked-repo",
        "identityPosture": "resolved"
      },
      "crawlScope": "cross_repo",
      "confidence": "high",
      "posture": "evidence_bound",
      "timestamp": "2026-04-21T23:20:00-04:00"
    }
  ],
  "skippedReferences": [],
  "posture": "evidence_bound",
  "timestamp": "2026-04-21T23:20:00-04:00"
}